Route_name,Route_link,Total_Buses
Gangtok to Siliguri,https://www.redbus.in/bus-tickets/gangtok-to-siliguri,
Siliguri to Gangtok,https://www.redbus.in/bus-tickets/siliguri-to-gangtok,
Siliguri to Rangpo,https://www.redbus.in/bus-tickets/siliguri-to-rangpo,
Rangpo to Siliguri,https://www.redbus.in/bus-tickets/rangpo-to-siliguri,
Siliguri to Pelling (Sikkim),https://www.redbus.in/bus-tickets/siliguri-to-pelling-sikkim,
Pelling (Sikkim) to Siliguri,https://www.redbus.in/bus-tickets/pelling-sikkim-to-siliguri,
Ravangla (Sikkim) to Siliguri,https://www.redbus.in/bus-tickets/ravangla-sikkim-to-siliguri,
Siliguri to Jorethang (Sikkim),https://www.redbus.in/bus-tickets/siliguri-to-jorethang-sikkim,
Singtham (Sikkim) to Siliguri,https://www.redbus.in/bus-tickets/singtham-sikkim-to-siliguri,
Siliguri to Singtham (Sikkim),https://www.redbus.in/bus-tickets/siliguri-to-singtham-sikkim,
Siliguri to Namchi (Sikkim),https://www.redbus.in/bus-tickets/siliguri-to-namchi-sikkim,
Siliguri to Ravangla (Sikkim),https://www.redbus.in/bus-tickets/siliguri-to-ravangla-sikkim,
Jorethang (Sikkim) to Siliguri,https://www.redbus.in/bus-tickets/jorethang-sikkim-to-siliguri,
Namchi (Sikkim) to Siliguri,https://www.redbus.in/bus-tickets/namchi-sikkim-to-siliguri,
Siliguri to Melli (Sikkim),https://www.redbus.in/bus-tickets/siliguri-to-melli-sikkim,
